{
  "$schema": "http://json-schema.org/draft-07/schema#",
  "title": "Sentry Span Attribute Schema",
  "description": "Describes an attribute and how it's meant to be used",
  "type": "object",
  "additionalProperties": false,
  "properties": {
    "key": {
      "description": "The name of the attribute, for ex. http.route",
      "type": "string"
    },
    "brief": {
      "description": "A description of the attribute",
      "type": "string"
    },
    "has_dynamic_suffix": {
      "description": "If an attribute has a dynamic suffix, for example http.response.header.<key> where <key> is dynamic",
      "type": "boolean"
    },
    "type": {
      "description": "The type of the attribute value",
      "enum": ["string", "boolean", "integer", "double", "string[]", "boolean[]", "integer[]", "double[]", "any"]
    },
    "apply_scrubbing": {
      "description": "How PII scrubbing should be applied to the attribute value. 'auto' scrubs automatically, 'manual' requires manual scrubbing rules, 'never' is never scrubbed. Optionally include a reason about why this mode applies",
      "type": "object",
      "additionalProperties": false,
      "properties": {
        "key": {
          "enum": ["auto", "manual", "never"]
        },
        "reason": {
          "type": "string"
        }
      },
      "required": ["key"]
    },
    "is_in_otel": {
      "type": "boolean"
    },
    "visibility": {
      "description": "The visibility of the attribute",
      "enum": ["public", "internal"]
    },
    "example": {
      "description": "An example value of the attribute",
      "anyOf": [
        {
          "type": "string"
        },
        {
          "type": "boolean"
        },
        {
          "type": "number"
        },
        {
          "type": "array",
          "items": {
            "type": "string"
          }
        },
        {
          "type": "array",
          "items": {
            "type": "boolean"
          }
        },
        {
          "type": "array",
          "items": {
            "type": "number"
          }
        }
      ]
    },
    "examples": {
      "description": "Example values of the attribute",
      "type": "array",
      "minItems": 1,
      "items": {
        "anyOf": [
          {
            "type": "string"
          },
          {
            "type": "boolean"
          },
          {
            "type": "number"
          },
          {
            "type": "array",
            "items": {
              "type": "string"
            }
          },
          {
            "type": "array",
            "items": {
              "type": "boolean"
            }
          },
          {
            "type": "array",
            "items": {
              "type": "number"
            }
          }
        ]
      }
    },
    "deprecation": {
      "description": "If an attribute was deprecated, and what it was replaced with",
      "type": "object",
      "additionalProperties": false,
      "properties": {
        "replacement": {
          "type": "string"
        },
        "reason": {
          "type": "string"
        },
        "_status": {
          "description": "How the attribute should be handled in the ingestion pipeline. 'backfill' copies the value to the new name. 'normalize' moves the value to the new name. 'transform' applies the referenced attribute transformation. Existing values for the replacement attribute will not be overwritten. The attribute should be backfilled or transformed for 90 days before status is set to normalize.",
          "enum": [null, "backfill", "normalize", "transform"]
        },
        "transformation": {
          "description": "The id of the attribute transformation to apply when _status is 'transform'. Transformation definitions live in model/attribute_transformations/.",
          "type": "string"
        }
      },
      "required": ["_status"],
      "allOf": [
        {
          "if": {
            "properties": {
              "_status": {
                "const": "transform"
              }
            }
          },
          "then": {
            "required": ["transformation"]
          }
        }
      ]
    },
    "alias": {
      "description": "If there are attributes that alias to this attribute",
      "type": "array",
      "items": {
        "type": "string"
      }
    },
    "search_alias": {
      "description": "How this attribute is exposed in Sentry search. Used to define user-facing aliases, narrowing search types, and allowing wildcard queries.",
      "type": "object",
      "additionalProperties": false,
      "properties": {
        "name": {
          "description": "The public name exposed in Sentry search",
          "type": "string"
        },
        "type": {
          "description": "The type exposed by Sentry search. Defaults to primary `type` if omitted",
          "enum": ["byte", "currency", "millisecond", "percentage", "second"]
        },
        "deprecated_aliases": {
          "description": "Deprecated aliases still accepted in search queries",
          "type": "array",
          "items": {
            "type": "string"
          }
        },
        "allowWildcard": {
          "type": "boolean",
          "default": true,
          "description": "Set to false to disable wildcard queries. Defaults to true. Only valid when type is string."
        }
      },
      "required": ["name"]
    },
    "additional_context": {
      "description": "A list of freeform notes providing additional context about how this attribute behaves, common pitfalls, or query-time nuances",
      "type": "array",
      "items": {
        "type": "string"
      }
    },
    "changelog": {
      "description": "A list of changelog entries tracking how this attribute has changed across versions",
      "type": "array",
      "items": {
        "type": "object",
        "additionalProperties": false,
        "properties": {
          "version": {
            "description": "The sentry-conventions release version",
            "type": "string"
          },
          "prs": {
            "description": "GitHub PR numbers",
            "type": "array",
            "items": {
              "type": "integer"
            }
          },
          "description": {
            "description": "Optional description of what changed",
            "type": "string"
          }
        },
        "required": ["version"]
      }
    }
  },
  "not": {
    "required": ["example", "examples"]
  },
  "allOf": [
    {
      "if": {
        "required": ["has_dynamic_suffix"],
        "properties": {
          "has_dynamic_suffix": {
            "const": true
          }
        }
      },
      "then": {
        "anyOf": [
          {
            "required": ["example"]
          },
          {
            "required": ["examples"]
          }
        ],
        "properties": {
          "example": {
            "type": "string"
          },
          "examples": {
            "type": "array",
            "items": {
              "type": "string"
            }
          }
        }
      },
      "else": {
        "oneOf": [
          {
            "properties": {
              "type": {
                "const": "string"
              },
              "example": {
                "type": "string"
              },
              "examples": {
                "type": "array",
                "items": {
                  "type": "string"
                }
              }
            }
          },
          {
            "properties": {
              "type": {
                "const": "boolean"
              },
              "example": {
                "type": "boolean"
              },
              "examples": {
                "type": "array",
                "items": {
                  "type": "boolean"
                }
              }
            }
          },
          {
            "properties": {
              "type": {
                "enum": ["integer", "double"]
              },
              "example": {
                "type": "number"
              },
              "examples": {
                "type": "array",
                "items": {
                  "type": "number"
                }
              }
            }
          },
          {
            "properties": {
              "type": {
                "const": "string[]"
              },
              "example": {
                "type": "array",
                "items": {
                  "type": "string"
                }
              },
              "examples": {
                "type": "array",
                "items": {
                  "type": "array",
                  "items": {
                    "type": "string"
                  }
                }
              }
            }
          },
          {
            "properties": {
              "type": {
                "const": "boolean[]"
              },
              "example": {
                "type": "array",
                "items": {
                  "type": "boolean"
                }
              },
              "examples": {
                "type": "array",
                "items": {
                  "type": "array",
                  "items": {
                    "type": "boolean"
                  }
                }
              }
            }
          },
          {
            "properties": {
              "type": {
                "enum": ["integer[]", "double[]"]
              },
              "example": {
                "type": "array",
                "items": {
                  "type": "number"
                }
              },
              "examples": {
                "type": "array",
                "items": {
                  "type": "array",
                  "items": {
                    "type": "number"
                  }
                }
              }
            }
          },
          {
            "properties": {
              "type": {
                "const": "any"
              }
            }
          }
        ]
      }
    },
    {
      "if": {
        "not": {
          "properties": {
            "type": {
              "const": "string"
            }
          },
          "required": ["type"]
        }
      },
      "then": {
        "properties": {
          "search_alias": {
            "not": {
              "required": ["allowWildcard"]
            }
          }
        }
      }
    }
  ],
  "required": ["key", "brief", "type", "apply_scrubbing", "is_in_otel", "visibility"]
}
