{
  "key": "cls.source.<key>",
  "brief": "The HTML elements or components responsible for the layout shift. <key> is a numeric index from 1 to N",
  "has_dynamic_suffix": true,
  "type": "string",
  "apply_scrubbing": {
    "key": "manual"
  },
  "is_in_otel": false,
  "example": "body > div#app",
  "alias": ["browser.web_vital.cls.source.<key>"],
  "deprecation": {
    "replacement": "browser.web_vital.cls.source.<key>",
    "reason": "The CLS source is now recorded as a browser.web_vital.cls.source.<key> attribute.",
    "_status": "backfill"
  },
  "visibility": "public",
  "changelog": [
    {
      "version": "0.5.0",
      "prs": [234]
    }
  ]
}
