{
  "key": "rpc.response.status_code",
  "brief": "Status code of the RPC returned by the RPC server or generated by the client.",
  "type": "string",
  "apply_scrubbing": {
    "key": "manual"
  },
  "is_in_otel": true,
  "example": "DEADLINE_EXCEEDED",
  "alias": ["code", "rpc.grpc.status_code"],
  "visibility": "public",
  "changelog": [
    {
      "version": "next",
      "description": "Added rpc.grpc.status_code as an alias"
    },
    {
      "version": "0.7.0",
      "prs": [352],
      "description": "Added rpc.response.status_code attribute"
    }
  ]
}
