{
  "key": "os.rooted",
  "brief": "Whether the operating system has been jailbroken or rooted.",
  "type": "boolean",
  "apply_scrubbing": {
    "key": "manual"
  },
  "is_in_otel": false,
  "example": true,
  "visibility": "public",
  "changelog": [
    {
      "version": "0.5.0",
      "prs": [301],
      "description": "Added os.rooted attribute"
    }
  ]
}
