{
  "key": "sentry.release",
  "brief": "The sentry release.",
  "type": "string",
  "apply_scrubbing": {
    "key": "never"
  },
  "is_in_otel": false,
  "example": "7.0.0",
  "alias": ["service.version", "release"],
  "visibility": "public",
  "search_alias": {
    "name": "release",
    "allowWildcard": false
  },
  "changelog": [
    {
      "version": "0.0.0"
    }
  ]
}
