{
  "key": "db.query.summary",
  "brief": "A shortened representation of operation(s) in the full query. This attribute must be low-cardinality and should only contain the operation table names.",
  "type": "string",
  "apply_scrubbing": {
    "key": "manual"
  },
  "is_in_otel": true,
  "examples": ["SELECT users", "INSERT products; UPDATE orders"],
  "visibility": "public",
  "changelog": [
    {
      "version": "0.19.0",
      "prs": [505],
      "description": "Added multiple examples"
    },
    {
      "version": "0.4.0",
      "prs": [208]
    },
    {
      "version": "0.1.0",
      "prs": [127]
    },
    {
      "version": "0.0.0"
    }
  ]
}
