{
  "key": "heroku.logplex.frame_id",
  "brief": "Unique identifier of the Heroku Logplex drain request, sent as the `Logplex-Frame-Id` header",
  "type": "string",
  "apply_scrubbing": {
    "key": "manual"
  },
  "is_in_otel": false,
  "visibility": "public",
  "examples": ["09C557EAFCFB6CF2740EE62F62971098"],
  "changelog": [
    {
      "version": "next",
      "prs": [752],
      "description": "Added heroku.logplex.frame_id attribute"
    }
  ]
}
