{
  "key": "app.app_name",
  "brief": "Human readable application name, as it appears on the platform.",
  "type": "string",
  "apply_scrubbing": {
    "key": "manual"
  },
  "is_in_otel": false,
  "example": "My App",
  "alias": ["app.name"],
  "deprecation": {
    "replacement": "app.name",
    "reason": "Deprecated in favor of app.name",
    "_status": "backfill"
  },
  "visibility": "public",
  "changelog": [
    {
      "version": "0.5.0",
      "prs": [296],
      "description": "Added and deprecated app.app_name in favor of app.name"
    }
  ]
}
