{
  "key": "bullmq.queue.options",
  "brief": "The options of a BullMQ queue operation as a JSON string, for example the options of Queue.retryJobs() or Queue.promoteJobs().",
  "type": "string",
  "apply_scrubbing": {
    "key": "manual"
  },
  "is_in_otel": false,
  "visibility": "public",
  "examples": ["{\"count\":1000}"],
  "additional_context": [
    "Added by BullMQ's telemetry interface. The Sentry SDK only forwards the attribute to Sentry."
  ],
  "changelog": [
    {
      "version": "next",
      "prs": [690],
      "description": "Added bullmq.queue.options attribute"
    }
  ]
}
