{
  "key": "mcp.session.id",
  "brief": "Identifier for an MCP protocol session, when the operation belongs to a session.",
  "type": "string",
  "apply_scrubbing": {
    "key": "manual"
  },
  "is_in_otel": true,
  "visibility": "public",
  "changelog": [
    {
      "version": "0.27.0",
      "prs": [671],
      "description": "Clarified that the identifier requires a real MCP protocol session"
    },
    {
      "version": "0.12.0",
      "prs": [420],
      "description": "Set is_in_otel=true, attribute exists in OTel MCP registry"
    },
    {
      "version": "0.3.0",
      "prs": [171]
    }
  ],
  "additional_context": [
    "Applies to protocol versions and transports that provide MCP session management, including legacy Streamable HTTP sessions. Omit for operations without a protocol session; do not synthesize a session identifier from a request, connection, or conversation."
  ],
  "examples": ["550e8400-e29b-41d4-a716-446655440000"]
}
