{
  "key": "sentry.dsc.trace_id",
  "brief": "The trace ID from the dynamic sampling context.",
  "type": "string",
  "apply_scrubbing": {
    "key": "never"
  },
  "is_in_otel": false,
  "example": "047372980460430cbc78d9779df33a46",
  "visibility": "internal",
  "changelog": [
    {
      "version": "0.3.0",
      "prs": [185]
    }
  ]
}
