{
  "key": "turbo_module.top.duration",
  "brief": "The total duration attributed to `turbo_module.top.name`, in milliseconds. Only applies to React Native.",
  "type": "double",
  "apply_scrubbing": {
    "key": "manual"
  },
  "is_in_otel": false,
  "visibility": "public",
  "examples": [87.25],
  "alias": ["turbo_module.top_module_duration_ms"],
  "changelog": [
    {
      "version": "next",
      "prs": [564],
      "description": "Added turbo_module.top.duration attribute"
    }
  ]
}
