{
  "key": "ai.texts",
  "brief": "Raw text inputs provided to the model.",
  "type": "string[]",
  "apply_scrubbing": {
    "key": "manual"
  },
  "is_in_otel": false,
  "example": ["Hello, how are you?", "What is the capital of France?"],
  "alias": ["gen_ai.input.messages", "ai.prompt.messages", "gen_ai.prompt", "ai.prompt"],
  "deprecation": {
    "_status": "backfill",
    "replacement": "gen_ai.input.messages"
  },
  "visibility": "public",
  "changelog": [
    {
      "version": "0.21.0",
      "prs": [583],
      "description": "Added ai.prompt as an alias"
    },
    {
      "version": "0.5.0",
      "prs": [264]
    },
    {
      "version": "0.1.0",
      "prs": [55]
    }
  ]
}
