{
  "key": "turbo_module.kind",
  "brief": "Whether the native module call completed synchronously or reported completion later through a Promise or a callback. One of `sync` or `async`. Only applies to React Native.",
  "type": "string",
  "apply_scrubbing": {
    "key": "manual"
  },
  "is_in_otel": false,
  "visibility": "public",
  "examples": ["sync", "async"],
  "changelog": [
    {
      "version": "next",
      "prs": [564],
      "description": "Added turbo_module.kind attribute"
    }
  ]
}
