{
  "key": "faas.invoked_provider",
  "brief": "The cloud provider of the invoked function.",
  "type": "string",
  "apply_scrubbing": {
    "key": "manual"
  },
  "is_in_otel": true,
  "example": "aws",
  "visibility": "public",
  "changelog": [
    {
      "version": "0.16.0",
      "prs": [481],
      "description": "Added faas.invoked_provider attribute"
    }
  ]
}
