{
  "key": "mcp.protocol.version",
  "brief": "Version of the Model Context Protocol used for the operation.",
  "type": "string",
  "apply_scrubbing": {
    "key": "manual"
  },
  "is_in_otel": true,
  "visibility": "public",
  "changelog": [
    {
      "version": "next",
      "prs": [671],
      "description": "Clarified that the protocol version applies to an operation without requiring a session"
    },
    {
      "version": "0.12.0",
      "prs": [420],
      "description": "Set is_in_otel=true, attribute exists in OTel MCP registry"
    },
    {
      "version": "0.3.0",
      "prs": [171]
    }
  ],
  "examples": ["2024-11-05"]
}
