{
  "key": "sentry.user.geo.region",
  "brief": "Human readable region name or code.",
  "type": "string",
  "apply_scrubbing": {
    "key": "manual"
  },
  "is_in_otel": false,
  "alias": ["user.geo.region"],
  "deprecation": {
    "replacement": "user.geo.region",
    "_status": "backfill"
  },
  "visibility": "public",
  "search_alias": {
    "name": "user.geo.region"
  },
  "changelog": [
    {
      "version": "0.10.0",
      "prs": [406]
    }
  ]
}
