{
  "key": "sentry.user.geo.country_code",
  "brief": "Two-letter country code (ISO 3166-1 alpha-2).",
  "type": "string",
  "apply_scrubbing": {
    "key": "manual"
  },
  "is_in_otel": false,
  "alias": ["user.geo.country_code"],
  "deprecation": {
    "replacement": "user.geo.country_code",
    "_status": null
  },
  "visibility": "public",
  "search_alias": {
    "name": "user.geo.country_code"
  },
  "changelog": [
    {
      "version": "0.10.0",
      "prs": [406]
    }
  ]
}
