{
  "key": "device.free_memory",
  "brief": "Free system memory in bytes.",
  "type": "integer",
  "apply_scrubbing": {
    "key": "manual"
  },
  "is_in_otel": false,
  "example": 2147483648,
  "visibility": "public",
  "changelog": [
    {
      "version": "0.5.0",
      "prs": [300],
      "description": "Added device.free_memory attribute"
    }
  ]
}
