{
  "key": "messaging.message.body.size",
  "brief": "The size of the message body in bytes.",
  "type": "integer",
  "apply_scrubbing": {
    "key": "manual"
  },
  "is_in_otel": true,
  "example": 839,
  "visibility": "public",
  "search_alias": {
    "name": "messaging.message.body.size",
    "type": "byte"
  },
  "changelog": [
    {
      "version": "0.4.0",
      "prs": [228]
    },
    {
      "version": "0.0.0"
    }
  ]
}
